{
  "$schema": "https://json-schema.org/draft/2020-12/schema",
  "$id": "https://webblock.invalid/contracts/events/project/source_published.v1.schema.json",
  "title": "Project: source published v1",
  "description": "DRAFT, proposed by provisioning, waits for project. Owner: project. The accepted source of one generation request of a project is the given commit of the given repository. Provisioning confirms the repository with Project and creates one release per project and generation request. subdomain is optional: the site's DNS label when Project already knows it.",
  "type": "object",
  "additionalProperties": false,
  "required": ["schema_version", "message_id", "message_type", "occurred_at", "correlation_id", "project_id", "generation_request_id", "repository_id", "git_commit_sha"],
  "properties": {
    "schema_version": { "const": 1 },
    "message_id": { "type": "string", "format": "uuid", "minLength": 36, "maxLength": 36, "pattern": "^[0-9a-f]{8}-[0-9a-f]{4}-[0-9a-f]{4}-[0-9a-f]{4}-[0-9a-f]{12}$", "not": {"enum": ["00000000-0000-0000-0000-000000000000"]} },
    "message_type": { "const": "project.source_published.v1" },
    "occurred_at": { "type": "string", "format": "date-time", "maxLength": 40 },
    "correlation_id": { "type": "string", "minLength": 1, "maxLength": 128, "pattern": "^[A-Za-z0-9._:-]{1,128}$" },
    "project_id": { "type": "string", "format": "uuid", "minLength": 36, "maxLength": 36, "pattern": "^[0-9a-f]{8}-[0-9a-f]{4}-[0-9a-f]{4}-[0-9a-f]{4}-[0-9a-f]{12}$", "not": {"enum": ["00000000-0000-0000-0000-000000000000"]} },
    "generation_request_id": { "type": "string", "format": "uuid", "minLength": 36, "maxLength": 36, "pattern": "^[0-9a-f]{8}-[0-9a-f]{4}-[0-9a-f]{4}-[0-9a-f]{4}-[0-9a-f]{12}$", "not": {"enum": ["00000000-0000-0000-0000-000000000000"]} },
    "repository_id": { "type": "integer", "format": "int64", "minimum": 1, "maximum": 9007199254740991 },
    "git_commit_sha": { "type": "string", "minLength": 40, "maxLength": 64, "pattern": "^([0-9a-f]{40}|[0-9a-f]{64})$" },
    "subdomain": { "type": "string", "minLength": 1, "maxLength": 63, "pattern": "^[a-z0-9]([a-z0-9-]{0,61}[a-z0-9])?$" }
  }
}
