{
  "schema_version": 1,
  "message_id": "1b2c3d4e-5f60-4b7c-8d9e-0f1a2b3c4d5e",
  "message_type": "project.source_published.v1",
  "occurred_at": "2026-10-24T09:30:00Z",
  "correlation_id": "8d7e6f50-4a3b-4c2d-8e1f-0a9b8c7d6e5f",
  "project_id": "5f0c2a8e-7c1b-4d2e-9a3f-1b2c3d4e5f60",
  "generation_request_id": "8d7e6f50-4a3b-4c2d-8e1f-0a9b8c7d6e5f",
  "repository_id": 4242,
  "git_commit_sha": "4f9c2b7a1e3d5f60718293a4b5c6d7e8f90123456789abcdef0123456789abcd"
}
